block_id,len_chars,est_sentences,preview
384,2117,21,"The Chanda (Malayalam: ചെണ്ട, [tʃeɳʈa]) is a cylindrical percussion instrument used widely in the state of Kerala, Tulu "
385,1727,18,"In 1794, when Sophie was 18, the Ecole Polytechnique was founded in Paris. It was an academy to train mathematicians and"
386,1643,16,"The Miami Heat are an American professional basketball team in the National Basketball Association (NBA) in Miami, Flori"
387,1661,20,By 1924 three-cushion had become so popular that two very well know players in other billiard areas agreed to play each 
388,2129,15,"The engineering of the Morden extension of the C&SLR from Clapham Common to Morden was more demanding, running in tunnel"
389,1851,22,"Clara is introduced a second time in the 2012 Christmas special ""The Snowmen"". This was her first episode as the Doctor'"
390,1650,17,The Croatian language is spoken mainly throughout the countries of Croatia and Bosnia and Herzegovina and in the surroun
391,1671,21,Urban design is a subject of urban planning focusing on design of cities or other urban areas. Whereas architecture focu
392,1851,16,"The first section requires states to recognize the ""full faith and credit"" of the public acts, records and court proceed"
393,2286,15,"At the end of 1988, Dunham was told by James McCawley, a talent booker for ""The Tonight Show with Johnny Carson"", that D"
394,1633,15,"On the morning of February 18, Hans and Sophie snuck into the University while classes were going. Spreading leaflets in"
395,1527,15,"Starting his career in the youth teams of Virtus Bologna, Marco Belinelli made his professional debut in LegA in 2002. I"
396,1597,17,"Internet Explorer 8 was released on March 19, 2009. It had been in development since August 2007. On March 5, 2008, the "
397,1513,27,"Unlike regular trivia games, the questions are given as clues, and players come up with questions as an answer. For exam"
398,1781,18,"The history of saffron growing reaches back more than 3,000 years. The wild plant from which the saffron crocus came was"
399,1769,13,"Late on September 4, an area of low pressure developed to the southeast of Okinawa, Japan. Over the next two days, the s"
400,1560,17,"The university building is an example of Stalinist architecture. In total, there are seven such towers around Moscow. Th"
401,2158,19,"The Xoraxane Roma in Turkey named official since the 1990's in Turkish as Romanlar (singular""Roman"", male ""Rom"", female "
402,1742,22,"The player controls Mac or Bloo. Both characters can throw paper balls, and you barely have to do that. Mostly you spend"
403,1899,19,"Elvis Presley was born on January 8, 1935 in Tupelo, Mississippi to 18-year-old Vernon Elvis Presley and 22-year-old Gla"
404,1933,19,"In his normal state, Mario can take one hit from an enemy and kill most of the monsters with a stomp. By opening doors, "
405,1660,18,"Colbert was born on September 13, 1903, to Georges Cauchoin and his wife, the former Jeanne Loew. Her family emigrated t"
406,2395,20,"The first version of the CCHA was launched in 1971 by four schools—Bowling Green, Ohio, Ohio State, and Saint Louis. The"
407,1556,7,"TeleRadyo Serbisyo (, previously known as DZMM TeleRadyo and as TeleRadyo / ABS-CBN TeleRadyo) is a Philippine pay telev"
408,1596,10,"""Rolling Stone""s reviewer gave the album 3 of 5 stars and found that it was best without the extensive concept surroundi"
409,1744,19,"As the pressure mounted in anticipation of his looming attack, Rodger turned to Xanax to alleviate his escalating anxiet"
410,1701,19,"Horsetooth Reservoir is a man-made lake just west of Fort Collins, Colorado, in southern Larimer County made for recreat"
411,1702,20,"On the evening of the raid, Filipino guerrillas cut the Japanese phone lines to Manila. They then blocked the two roads "
412,1686,10,"The bilateral relations between the Republic of India and Taiwan have improved since the 1990s, India has expanded econo"
413,1565,15,"Many television commercials, comic strips and other media depict this as a sort of humorous business, with Santa's elves"
414,1654,33,"About 5.30 a.m. on the morning of July 1, the battle started. Heth probed ahead cautiously to a point about two miles we"
415,1662,10,The next membership change came in July 2022 with the arrival of football-sponsoring Austin Peay State University from t
416,1589,13,"Rodger developed a deep resentment towards the people in Isla Vista, seeing himself as a sophisticated person deserving "
417,1860,14,Para-alpine skiing classification is the order system for para-Alpine skiing designed to give equal competition between 
418,1672,16,"In March 1998, TWC introduced a graphical refresh, featuring heavy use of the Akzidenz-Grotesk typeface and footage of c"
419,1574,13,The process of integration took 7 years during which Merwan often stayed at Upasni's ashram. He also visited with Babaja
420,1885,15,"The Abraham Accords are a set of diplomatic documents between Israel, the United Arab Emirates (UAE), and Bahrain. They "
421,1611,11,"Lesbian, gay, bisexual, and transgender (LGBT) persons in Tunisia may face legal challenges not experienced by non-LGBT "
422,1544,13,"Coheed and Cambria (sometimes abbreviated to ""Coheed,"" ""CO & CA"" or ""C&C"") is an American rock band from New York. Cohee"
423,1749,19,"Gottfried Wilhelm Leibniz (also ""Leibnitz"" or ""von Leibniz"") 1 July 1 (21 June OS) 1646 – 14 November 1716) was a German"
424,1976,19,"When Muhammad bin Saud died in 1765, his son Abdulaziz bin Muhammad Al Saud who was a dedicated student of Muhammad ibn "
425,1576,20,"Since the start of her career, Godigna Collet tried to find a balance between people and environment. She found it throu"
426,1523,15,"After the 1966 FIFA World Cup, preparations began for the next tournament, the 1970 FIFA World Cup in Mexico. During the"
427,2053,27,Patricia Honor Richardson MBE (née Greene; born 1931) is an English actress. She is best known as the voice of on the BB
428,1695,14,"COVID-19 did not affect everyone in each country the same way. As of May 2020, APM Research Lab said the death rate amon"
429,1526,16,"A worldwide area network, or WAN, is made up of several computer networks connected together, often over the Internet. I"
430,1927,27,Hans-Gerd Schildt (born 12 June 1952) is a former German football player. After the end of his career he became football
431,1744,21,In November 2007 the whole tramway closed for the first time. It was closed for five months for the second part of an £1
432,1867,13,Although Schonberg had been critical of Lupu's debut with the Cleveland Orchestra conducted by Barenboim in February 197
433,1521,14,Another feud from Raw was between Shawn Michaels and Vince McMahon. At the Royal Rumble Vince distracted Michaels as his
434,1973,18,"Late on August 19, an area of low pressure developed north of Palau. Early on August 20, the system became more better o"
435,1633,17,The movie begins with two air force officers in a nuclear missile silo who are ordered to fire the missiles in the silo.
436,2383,36,"Externally, exports to Russia, which was more than 60 percent of total exports, fell during the second half of 1998 by 1"
437,2306,17,Mobileye is an Israeli technology company that specializes in developing advanced driver assistance systems (ADAS) and a
438,1594,28,"Herbert Aaron Hauptman (February 14, 1917 – October 23, 2011) was an American mathematician. He won a Nobel Prize. He ma"
439,2212,25,"Miyamoto thought of many characters and story ideas, but eventually decided on a love triangle between a gorilla, a carp"
440,1854,21,"While going through the Philippines, Banyan had heavy rains across much of the country. This led to widespread flooding."
441,2319,34,An extratropical cyclone turns anticlockwise in the Northern Hemisphere. The shape is circular or oval. The usual diamet
442,2162,23,"In Congress, Sickles had aligned himself with Southern Democrats and was himself a pro-slavery Democrat. But after the o"
443,1975,14,"The genre has been traced back to the electronic game Simon, invented by Howard Morrison and Ralph Baer (the latter also"
444,1784,13,"""Broken Sword: The Shadow of the Templars"" got very good reviews from critics. ""Adventure Gamers"" praised the game's sto"
445,1562,13,"In 1969, the party suffered a major split. A faction was led by Indira Gandhi, leaving to establish the Congress (R), wi"
446,2200,24,"Between the ages of nine and 15 years (on average, at 12 to 13 years), the vagina and uterus (womb) become bigger. The u"
447,1698,17,"Matt Vasgersian (born September 28, 1967) is an American sportscaster. He works for MLB Network. He is the new pregame/p"
448,1641,15,"With the attacks unfolding, air traffic officials began issuing warnings through the Aircraft Communication Addressing a"
449,1841,19,"When the temple was finished, King Solomon brought the of the Lord's covenant to the temple and made all the people of I"
450,1762,17,"Hurricane Eta had life-changing effects on Honduras, largely due to flooding. Flooding caused 559 residents to get out o"
451,1703,10,"Recently, there have been proposals and a law has been enacted in Oklahoma for a variation, so-called nitrogen gas, eith"
452,1703,16,Danilo made his international debut during Copa América 1945 when Brazil finished second and also in 1946. He won the Ro
453,1671,23,Attitudes toward slavery were shifting; a protected the African slave trade only until 1808. The Northern states permane
454,1566,9,"The first Muslim conquests (632–732), (, Fatah, literally ""opening"",) also referred to as the Islamic conquests or Arab "
455,2187,12,Historical and ethnic studies published and promoted by the various ruling classes during their governance over Malta pr
456,1632,10,"Researcher Sean Murphy has suggested that a man standing on the Depository front steps in the Dave Wiegman, Jr. and Jame"
457,1508,12,In 1863 the Metropolitan Railway opened in London between Paddington and Farringdon. It was the world's first undergroun
458,1621,11,Household income in the United States varies a lot with the age of the person who heads the household. The median househ
459,2030,17,"On the January 30 episode of ""Raw"", entered a feud with Chris Jericho after Jericho attacked Punk and Daniel Bryan durin"
460,1690,31,"At night, the children ask their father to tell them a story. He tells them how when he and Deianeira first met. Hercule"
461,1699,19,The Diary of Alicia Keys is the second studio album from American R&B/soul pianist and singer Alicia Keys. It was releas
462,1535,13,"During maturation, a process occurs that involves progressive neurodegeneration and/or the death of neurons. This proces"
463,2105,27,16-year-old Jernej Slivnik had a shoulder injury five months before the 2018 Games. He started practicing again at a ski
464,1880,14,"In 2013, the Super Kings strengthened their bowling attack by signing up five overseas and five Indian bowlers. In the I"
465,1696,18,"Rosa Luxemburg (5 March 1871 in Zamość, Russian Poland – 15 January 1919 in Berlin) was a Polish-Jewish Marxist politici"
466,1629,14,Sindh was the first place in the Indian subcontinent to not only be conquered by a Muslim state but also the first to ha
467,1636,11,"April 1987 Fengning Manchu Autonomous County officially listed. Fengning paper cutting has a long history, Fengning folk"
468,2385,19,"""The Lightning Thief"" received mostly positive reviews. Common Sense Media said ""there are two levels of fun in ""The Lig"
469,1516,16,"Three minutes later, Griezmann took a corner kick into the penalty area. Matuidi tried to score with a header, but it di"
470,1559,27,"After an argument with Eazy-E over money, Dre left the group in 1991 under the advice of a friend, The D.O.C. and his bo"
471,1613,8,"Meanwhile, Virus warns Farhan and Raju about the effects of them being friends with Rancho by pointing out the modest fi"
472,2275,23,The first Intifada is often known for its nonviolent nature. The nonviolent resistance from Palestinians existed of the 
473,1718,10,In his experiment of the sun light he extended his observation of the penetration of light through the pinhole to conclu
474,2020,18,"Following a tour stop in Munich, Germany on March 1, 1994, Kurt was diagnosed with severe Bronchitis. He flew to Rome th"
475,1544,15,It is common across North America between Alaska/Canada and Central America. It is the single most widely distributed ge
476,1530,25,"Mr. Harrel threatens her with his own suicide, so Cecilia lends him money for his debts. Mr. Delvile is suddenly called "
477,1585,6,"In general, during the Umayyad period ""Ajam"" was a pejorative term used by Arabs who believed in their social and politi"
478,2278,16,"Rani Mehra is a 24 year-old sheltered, meek, yet good-natured young Punjabi woman from Delhi. One day before her wedding"
479,1789,13,"A motorhome, recreational vehicle or in British English, a caravan is a bus-like vehicle equipped for habitation, like a"
480,1549,23,"Lottt released her first single, ""Mama Do"", on 8 June 2009. The video was directed by Trudy Bellinger. It was released t"
481,1623,16,"On January 15, 2014, Rodger had a fight with Hong after accusing him of stealing three candles worth $22. Rodger placed "
482,1667,19,Archaeological discoveries show the first settlements were in the Trent river valley. The original kingdom of Mercia had
483,1546,10,"Melvin wears a blue superhero costume, and is used to poke fun at superheroes. When asked about his superhuman powers, h"
484,1883,18,"Selena co-wrote with David Byrne, former lead singer of Talking Heads, for his gospel song ""God's Child (Baila Conmigo)"""
485,1519,11,"It is reported that this problem with the CL&SS contributed to the bankruptcy of the cable company in 1888. However, ele"
486,1710,14,"On April 30, 2014, Rodger's mother became worried after she hadn't heard from her son in four days. She found the videos"
487,1549,25,Perambalur is a municipality town in the state of Tamil Nadu . It is the administrative headquarters of Perambalur distr
488,1502,13,"At 11.00 PM on December 2 1984, while most of the one million residents of Bhopal slept, an operator at the plant notice"
489,2296,21,"In 1929, he played for Syrio and Libanez. In 1931, Leônidas moved to Bonsucesso, where he began his semi-professionaliza"
490,1785,13,"In 1943, a former Civilian Conservation Corps camp outside Moab was used to confine Japanese American internees labeled "
491,1966,24,"Many experiences came through Kerouac's friendship with Neal Cassady. Cassady was a handsome, bright young with a teenag"
492,1645,18,"The third try at a constitution was called the Leavenworth Constitution. It was called that because on March 25, 1858, t"
493,1608,17,"As a part of cooperation in the field of tourism, the Government of Maharashtra had signed a Memorandum of Understanding"
494,1503,12,"Motivated by their Puritan religion, some Austrailian women in 17th century opened small, private schools in their homes"
495,2228,29,Austria national football team is the national football team of Austria. It is controlled by the Austrian Football Assoc
496,1671,16,"Didi started playing football for Madureira in 1947. In 1949 he transferred to Fluminense, one of Rio's biggest clubs. T"
497,1761,15,"Spencer found out about her casting during the spring of 1950, when she was rehearsing a radio play in the Birmingham St"
498,1549,10,"In ""Journey's End"" the Doctor regenerates just enough to heal himself, moving the rest of his 'Time Lord' regenerative e"
499,1514,18,"Sunrisers Hyderabad (stylised as SunRisers Hyderabad, SRH) are a franchise cricket team based in Hyderabad, Telangana, I"
500,1627,21,"In 1842, two LDS missionaries were preaching in the Wilton, Connecticut area. One of the missionaries was Charles Wesley"
501,1914,30,Master Chief is the last super soldier who is able to fight on the Pillar of Autumn. The Pillar of Autumn jumped (telepo
502,2110,27,"The movie is about a mermaid princess named Ariel. She and her best friend, a fish named Flounder, explore the ocean loo"
503,1736,10,"São Paulo (Portuguese for ""Saint Paul"") is the capital of the state of São Paulo, Brazil. It is the biggest city in Sout"
504,1681,12,"In 2018, he studies in art school. The same year, he followed audiovisual internships in various associations, where he "
505,1684,14,Botvinnik played no formal competitive games after winning the 1948 match tournament until he defended his title. In 195
506,1835,21,"At the time Thutmose became king, Nubia rebelled against Egyptian rule. Thutmose travelled up the Nile with his army and"
507,2075,9,"The late historian Paul Murray Kendall, on the other hand, maintained that Margaret's allies Edmund Beaufort (Somerset) "
508,2116,18,"The 18th century British colonists in the Mughal-Muslim Indian subcontinent, were repulsed by the sight of Hijras (trans"
509,1542,8,The crow characters in the movie are often seen as African-American stereotypes. The leader crow voiced by Cliff Edwards
510,1525,22,William's northern army was wiped out and York was in ruins. At the same time smaller rebellions were breaking out in Wa
511,1576,13,The words of Ohata's citation explain: Sergeant Allan M. Ohata distinguished himself by extraordinary heroism in action 
512,1524,14,"Near the 1920s, Skłodowska-Curie and many of her colleagues began to suffer from symptoms of cancer. Skłodowska-Curie be"
513,1570,8,"The player wins by increasing their net worth to at least the target amount (usually determined by the game, if on Custo"
514,1865,19,"After Miguel’s coma ends, Johnny helps him learn to walk again. Sensei John Kreese breaks into Daniel LaRusso’s car comp"
515,1520,13,"The Daleks returned in the 2008 series' two-part finale, ""The Stolen Earth""/""Journey's End"", accompanied once again by t"
516,1621,21,The last of Lee's infantry was crossing the river by early afternoon on September 19. Lee then sent General J.E.B. Stuar
517,2107,21,"Rajinikanth continued to act in Bollywood, often playing supporting roles in films such as ""Hum"", ""Khoon Ka Karz"", and """
518,1835,26,"On August 15, Tropical Depression Three formed and quickly strengthened into Tropical Storm Bill. On August 17 Tropical "
519,1721,9,"Cushitic populations have existed at the cross-roads of Africa and Eurasia since the Stone Age, with the Nile acting as "
520,1655,15,Cook's men were confronted on the beach by an elderly kahuna who approached them holding a coconut and chanting. They ye
521,1769,14,"In spring of 1954, in New York City, just before his passing Pascal had planned a trip to India to see Meher Baba one la"
522,2149,24,"According to review aggregator Metacritic, the album has an average critic review score of 67/100 based on four reviews,"
523,1606,20,The palace was originally built in 1612 by Marie de' Medici on lands she owned. The design was based on buildings from h
524,1875,17,"In 1765, her older brother died of consumption at Fontainebleau at the age of 36. Victoire, like all of her sisters, mou"
525,1510,13,"Beginning in 1881, European Jews began to move to Palestine in large numbers. These new immigrants mainly settled in the"
526,1936,10,"Ziaur Rahman Azmi in his book """"Dirasat fil Yahudiyat wal Masihiyat Wal Adianil Hind"""" (دراست في اليوديه والمسيحيه واديا"
527,1686,17,"An area of disturbed weather, related to Tropical Depression Eight, moved across the northwest Caribbean Sea and the Yuc"
528,1789,19,"The main characters in the series are Lucky, Cadpig, Rolly, and Spot. Lucky is the most adventurous of the 99 puppies an"
529,1518,9,"The Boxer Movement or Boxer Rebellion, which occurred in China from November 1899 to September 7, 1901, was an uprising "
530,1603,16,"The narrow coastal plain rises very rapidly into several mountain ranges. The coastline is 1,000 km, 750 km of this is i"
531,1872,13,The video starts off with Taylor seen without his mask and dressed in casual clothes carrying a shovel and smoking a cig
532,1711,9,"Luigi Tagliaferri, known as Luigi di Pagnona, was born in Pagnona in Valsassina, but grew up in Mandello, descendant of "
533,1680,13,"""Ultra Q"" was originally the first Ultra Series but it featured any of the Ultras without monsters and came ""Ultraman"". "
534,1735,13,"""I Kissed a Girl"" debuted at number 76 on the ""Billboard"" Hot 100. After a couple of weeks, the single hit the top 5, du"
535,1827,12,"By February 2012, Rodger's frustration with his social interactions, particularly with blond women whom he perceived as "
536,1506,17,"Tommy, Alex and Gibson join some soldiers of a Highlanders regiment and hide inside a beached trawler in the intertidal "
537,1842,17,"In the final book, Annabeth first appears when Percy returns from blowing up Kronos's ship, the ""Princess Andromeda"". Fo"
538,1756,23,"Eastern Chalukyas, also known as the Chalukyas of Vengi, was a dynasty that ruled parts of South India. It ruled for a p"
539,2054,10,Quan Chi is a nefarious free-roaming sorcerer and necromancer who is one of the Mortal Kombat series' main villains. He 
540,2154,21,Atreyu are an American heavy metal band. They are signed to Roadrunner Records. They took their name from a character ca
541,2265,32,"In the present, Billy Batson is taken in by a new family after having repeatedly run away from foster homes to try to fi"
542,2190,29,"Okubo was born in Kanda, Fukuoka on June 9, 1982. After graduating from Kunimi High School, he joined J1 League club Cer"
543,2296,23,Tensions between slave and free states mounted with arguments over the relationship between the state and federal govern
544,1752,23,"Under Stewart and Karlin ""The Daily Show"" developed a markedly different style, bringing a sharper political focus to th"
545,1836,27,Oliver explained that he and his team talked to Murray Energy about this segment before showing it. He said that he rece
546,1856,19,"In many branches of science, including mathematics, mathematical optimization is a branch that is about finding a right "
547,1537,17,"Idi Amin had a controversial foreign policy. He expelled Asian communities, leading to strained relations with the UK an"
548,1576,12,"Nick Cassidy (Sam Worthington) enters a hotel room, pretending to be called Joe Walker. After eating a meal and wiping h"
549,2276,20,"He is best known for his roles on the ""ITV"" breakfast programmes ""GMTV"", ""Daybreak"" and ""Good Morning Britain"". In 2005,"
550,1648,22,"Between Rouen and the sea, ocean-going vessels of up to in length, and 150,000 tons in weight can travel the Seine. This"
551,2308,17,"The theme is doppelganger. The narrator is a dying man of ""a noble descent"" who choses not to embody a record of his lat"
552,1959,11,"During the seventeenth century, as an aspect of Romantic ""Primitivism"", the figure of the ""Good Savage"" was held up as a"
553,1620,16,"The story of Parsifal and the Holy Grail has survived in several forms that date from between 1170 and 1220. Wagner, who"
554,1582,12,As a child Lemlich experienced the many struggles of people living under the Russian Monarchy. Lemlich and her family fl
555,1540,17,DE 82 heads to the west of DE 52 near Greenville as Campbell Road. The road has two lanes cars can travel on without a m
556,1704,12,The oval-shaped zero and circular letter O came into use together on modern character displays. The zero with a dot in t
557,1671,22,In 1328 Robert the Bruce was in poor health and was dying. One thing he had not been able to do was to go on a crusade. 
558,1522,20,Once Angom Nongban Kongyamba met fisher women from the Khuman kingdom in a place called Moirang. Both the Khuman kingdom
559,1703,14,Le Guin earliest work stayed the most popular and got the most recognition. A reviewer in 2018 said that she often lectu
560,1613,17,Puducherry sustained relatively minor damage in November as the depression largely remained offshore; some trees were do
561,1681,10,"In the 1908 Toronto municipal election, held January 1, 1908, former alderman Joseph Oliver was elected Mayor of Toronto"
562,1673,20,Crusio got in 1979 a master's degree and then in 1984 a PhD from the Radboud University Nijmegen. He performed research 
563,1508,15,A typical column used in SEC has two substances called phases that interact with the mixture and these substances help f
564,1766,17,"Eriksen started the 2010–11 season well, scoring his first Ajax league goal on 29 August 2010 in an away victory over De"
565,1542,22,She started swimming in 1927 after her mother found out about the collective lessons of Mouettes de Paris. In July 1929 
566,1596,14,Watson confronts Laura Lyons who admits that Charles Baskerville had financed her typewriting business and says she did 
567,1549,21,Niko Kovač (born 15 October 1971) is a former Croatian football player. He has played for Croatia national team. He was 
568,1521,12,"Umm Yasmin, of the Centre for Muslim Minorities and Islam, says that feminism is often mistaken as a western movement. A"
569,1892,20,The 1968 Democratic National Convention of the U.S. Democratic Party was held at the International Amphitheatre in Chica
570,1588,10,"Aurel Stein discovered 5 letters written in Sogdian known as the ""Ancient Letters"" in an abandoned watchtower near Dunhu"
571,1504,9,"Cell is an artificial life form (referred to as a ""Bio-Android"") created by Doctor Gero's supercomputer from the cell sa"
572,2000,15,"Asylum Records is an American record label, owned by Warner Music Group. After several incarnations, today it is primari"
573,1565,17,2013 he took part in his 5th World Championships in Paris. He doesn't won a medal for the second time- in the Quarterfin
574,1755,8,In 1817 John Leslie (a Scottish mathematician) suggested that primitive societies may have evolved counting with objects
575,1639,7,Nicolae Ceauşescu (; 26 January 1918 – 25 December 1989) was a Romanian communist dictator from 1965 until 1989. After t
