block_id,len_chars,est_sentences,preview
767,1614,9,Multiple kelp species often co-exist within a forest; the term understory canopy refers to the stipitate and prostrate k
768,1568,23,"Beethoven continued to write compositions: a Violin Concerto, symphonies, piano concertos, string quartets and chamber m"
769,1580,17,"Back in Paris, George tracks down Jacques Marquet to the Hagenmeyer clinic. Posing as a doctor George gains access to Ma"
770,1718,22,"In a series of battles fought all across Northumbria, Oswiu kept being pushed back until he reached the far north of his"
771,1743,12,"In August 2014, after nine years of litigation by Robert Soto (Vice-chairman of the Lipan Apache Tribe of Texas) and oth"
772,2076,22,"His parents were Sovetian National players, so they trained Dima in his childhood. 2005 he got into the Bundesleague. Hi"
773,1911,14,"Following the murders of the three men, Rodger discarded his blood-drenched clothes and made his way to Starbucks. There"
774,2048,19,"On the following Raw, John Cena was paired with Michael Tarver. After their match, Cena attacked Tarver. Barrett said th"
775,1923,14,"On the day of the trial, Scout, Jem and Dill sneak into the amphitheater where they are having the hearing even though A"
776,1889,17,"Abigail Williams ( 1680 or 1681disappeared 3 June 1692) was a girl who, along with her supposed relative Betty Paris, wa"
777,1544,11,"The sweeper, also known as the libero, is a crucial position in association football. Unlike other defenders who have a "
778,2020,12,"Born in the United States, he returned to Italy in the early fifties to open an atelier in Rome in the highly fashionabl"
779,1945,8,We may bring that experience to the world of atomic-sized phenomena and incorrectly assume that if we measure the positi
780,1594,12,"GoodBarber was born from the merger of two French software companies, DuoApps and WebzineMaker, It was founded in 2001, "
781,2052,9,"Statistically speaking, elevators are extremely safe. Their safety record is unsurpassed by any other vehicle system. In"
782,1632,23,"Even with the addition of the chicanes, safety was a concern at the circuit. One of the biggest worries was the high-spe"
783,2114,20,"The team entered the next season with a new sponsor - the tobacco company Benson and Hedges, which sponsored Jordan unti"
784,2223,12,Traditional English renderings of Greek names originated from Roman systems that were established in antiquity. The Roma
785,1862,12,Shams convinced Rumi that at certain moments it was possible to commune directly with God: Rather than believers simply 
786,2173,16,The American botanist Joseph Rock saw the fighting between the Hui Muslim warlord Ma Qi and the Tibetan Buddhist of Labr
787,1704,11,"Lohan's parents are Dina Lohan and Michael Lohan, both of whom are of Irish and Italian descent. She has a sister named "
788,1552,22,The beginning of Allison was a tropical wave that moved off of Africa on May 21. The wave moved all the most across the 
789,1592,19,"On June 9, 1862, the last of the six battles of Jackson's Valley Campaign was fought at Port Republic, Virginia. Jackson"
790,1605,23,It starts with an old woman telling a story about snow to her granddaughter. The story is about an unhappy young man nam
791,1597,13,"The history of Mt Garibaldi involves an initial period of volcanism (200,000-300,000 years ago) followed by a period of "
792,1512,16,"In the sixth month, the angel Gabriel was sent from God to a town of Galilee called Nazareth, to a virgin betrothed to a"
793,1547,14,"In 1913, Freud published ""Totem and Taboo"". It was an attempt to reconstruct the birth and the process of development of"
794,1971,18,"Later that year, Harris was charged with twelve counts of having indecent assaulted girls aged 7 to 19 during the 1960s "
795,1507,43,To make a navbar in Tailwind CSS you would use this HTML code: <!--The style and script tags at the top are for offline 
796,1591,14,"Utah has a dry, semi-arid to arid climate, although its many mountains have large, wide, differences of climates, with t"
797,1523,8,"""Le Morte D’Arthur"" was written in Middle English, a period of the English language in 11th to 15th century England. Pub"
798,1790,17,"Late on July 23, an area of low pressure formed to the southeast of Chuuk. the system gradually drifted to the west and "
799,1590,14,"Bruce's ""Zen Garden"" caused problems at Casaya and Aras felt he should have been helping with camp . The tribe that won "
800,2267,17,"On May 23, 2014, Elliot Rodger, carrying 6- and 8-inch ""SRK"" and nine-inch boar hunting knife, first attacked his roomma"
801,1640,14,"During the third act of the play, following a line in the play that was the biggest laugh of the night, Lincoln was laug"
802,1715,16,"Though he loves Pluto, the narrator begins to suffer from violent mood swings, predominantly due to the influence of alc"
803,1626,14,"Kohli's playing style is widely regarded as aggressive, a trait that extends to his leadership on the field. Kohli is kn"
804,1971,38,"It will be remembered that in the month of October, 1897, reports were received here of the probable loss of the whaling"
805,1556,18,"Al Ain (Arabic: العين) is a city in the United Arab Emirates. The city name literally means ""the spring"" or ""the eye"" in"
806,2360,25,Original settlers of the Christchurch region were Moa Hunters. These settlers hunted the moa out of existence by about t
807,1670,15,Arguments between the farming-based South and industrial North over the growth of the institution of slavery and states'
808,1559,27,"Fawzi was born in a village near Quwaysina, Monufia Governorate. His father graduated from al'Ulum and the Shari'a Judge"
809,1934,13,A capacitor is a very common electrical circuit device that can store electrical energy as charge. It works based on the
810,1659,15,Maroon Berets are all recruited from high rank Army officers who volunteer to join. Each recruit must have at least serv
811,1943,13,"Early on September 13, a low pressure area formed northeast of the Northern Mariana Islands. The system gradually drifte"
812,2171,12,"The Jodhra tribe converted to Islam in the hand of Mahmud of Ghazni, they came to Attock in the end 16th Century and got"
813,1673,25,The common toad usually moves by walking rather slowly or in short jumps using all four legs. It spends the day hiding. 
814,1727,13,"Kathiababa Ka Sthan is located on Vrindavan Gurukul Road, Mathura District, Uttar Pradesh, India. The architectural styl"
815,1933,13,"On the eve of World War I in 1914, around two million Armenians lived in Anatolia out of a total population of 15–17.5 m"
816,2175,20,"The second edition of ""Arkzin"" ran for 93 issues, the first of which appeared on April 1st 1992. Initially a monthly, st"
817,1833,13,"By early on October 17, the outer rainbands, which had previously controlled the structure of the cyclone, dissipated, w"
818,1669,22,"According to beliefs, Goddess Yumjao Leima is the divine representation of the (Royal Mother) of the kingdom. All the po"
819,1772,21,"Jai is fired from the case, but is encouraged by Ali to prove Sahir's guilt. Jai eventually finds out about Samar, and s"
820,2192,16,"In August 2013, fueled by resentment over his broken ankle and repeated rejections from women, Rodger concluded that his"
821,1656,14,"The next match of the evening was the fourth-yearly Money in the Bank ladder match, featuring Chris Jericho, Mr. Kennedy"
822,1528,13,"EMI Latin believed Selena should release a crossover album, believing she had reached her peak in the Spanish-language m"
823,1503,10,"Two American nightclub owners from New York City, Travis (John Travolta) and Wendell (Arye Gross) are drugged and kidnap"
824,1820,26,"Sogahata was born in Kashima on August 2, 1979. He joined J1 League club Kashima Antlers based in his local from youth t"
825,1583,13,"In 2022, Iran had a dress-code which specified what kinds of clothes were acceptable in public, and which ones were not."
826,1731,26,"When he started the Marathon of Hope, Fox had to run through very bad weather. He ran through strong wind, rain, and sno"
827,1764,14,"In 2017,the Syrian National Army was formed, the group was named the ""Turkish-Backed Syrian Free Army"". A lot of the Fre"
828,1904,10,"Antonio Prohias (January 17, 1921 – February 24, 1998) was a Cuban-born cartoonist. He is best known as the creator of S"
829,1626,27,Judith returned to France the widow of her own stepson. To avoid scandal her father was keeping her under close guard at
830,1648,17,"The ""hand cannon"" was first used in China in 1288. From this early beginning and a number of different guns, the smoothb"
831,1773,20,An erection () most often refers to an erection of the penis. Erections sometimes occur in the male fetus (the body befo
832,1924,14,"While British Columbia was ""technically"" a British colony, it was the private corporation, the Hudson's Bay Company (HBC"
833,1809,18,The reunion dinners on the day before Chinese New Year are often the largest and most expensive of the year. Some famili
834,1765,11,"Despite moderate wind shear, convection soon wrapped around the southeastern side of the low-level circulation. By 21:00"
835,1523,16,"In this book Eragon, with his dragon Saphira visits the elf city Ellesmera to complete his training. He is accompanied b"
836,1633,13,"Since 1947, there have been 14 different prime ministers. The first few decades after 1947 saw the Indian National Congr"
837,1789,13,The words of Muranaga's citation explain: Private First Class Kiyoshi K. Muranaga distinguished himself by extraordinary
838,1699,14,In 1847 pioneer Jane Dillworth held the first classes in her tent for the children of the first LDS families. In the las
839,1725,17,"Between 1964 and 1977, Carlos Alberto Torres was capped 53 times and scored eight goals with Brazil. In 1966, he was on "
840,1682,25,"The conflict started as a small insurgency. It spread to most parts of the area within a year. By the summer of 2019, th"
841,1901,12,"The balance of power was shifted in favour of anti-Communists in December 1965, when personnel from both the Army Para-c"
842,1647,12,"In the ""Mario Kart"" series, players compete in go-kart races, controlling one of a selection of characters from the ""Mar"
843,1734,15,The Commonwealth of Independent States (CIS) is the confederation of countries that used to form the Soviet Union. On De
844,1546,15,"The University of Kansas started a men's basketball program in 1898, following Naismith's arrival. This was only six yea"
845,1579,22,"Schistosomiasis, also known as snail fever and bilharzia, is a disease caused by parasitic flatworms called schistosomes"
846,1858,10,"During Comic-Con 2009, numerous sixth-season reports were made. Carlton Cuse stated both the time travel and flash-forwa"
847,1522,23,"Many prime-time programs of the 1970s were run by independent producers, often in association with a major Hollywood stu"
848,1703,15,"The Fertile Crescent (an area now mostly in Iraq, Syria and Turkey) was the first place where humans learned to farm. Ch"
849,1532,12,"In Chicago at the time of the 1893 World's Columbian Exposition, Holmes opened a hotel which he had designed and built f"
850,1751,14,Unit 731 was a biological and chemical warfare research and development unit of the Imperial Japanese Army. It engaged i
851,1714,11,From 1973 until 1997 the Hill Tracts area was the scene of a guerrilla war between the Bangladeshi army and the Shanti B
852,1914,25,"Having had command of the Army of the Potomac for only three days, and having to deal with a Confederate army which had "
853,2168,20,"When he was 14, Nostradamus succesfully passed the test and was accepted to attend the University of Avignon. He attende"
854,1697,23,EXO is a boy group of South Korea formed by S.M. Entertainment in 2011. At the beginning of 2012 it was formed completel
855,1566,7,"Around 1933–1934, the Yadavs joined with the Kurmis and Koeris to form the Triveni Sangh, a caste federation that by 193"
856,1621,18,"Another popular practice on Čahāršanba-sūrī is fortune telling from a jug (fāl-e kūza, fāl-e bolūnī), usually one with a"
857,1654,14,"During the Belgian Grand Prix, Verstappen collided with Räikkönen at the first corner, pushed Vettel, Räikkönen and Pére"
858,2111,14,"Candace Flynn is having an unusually good day, but then she finds out that her brother Phineas Flynn and stepbrother Fer"
859,1686,15,The trio enter the Underworld and cross the River Styx. Persephone takes them to Hades. Percy tries to explain to Hades 
860,1590,14,Slenderman was created during a contest on the Something Awful forums in June 2009. The goal was to change photographs u
861,1517,11,Warded locks are the simplest locks to pick and are picked by inserting a warded lock pick (also called a skeleton key) 
862,1643,13,"According to Mihran Prgiç Gültekin, the head of the Union of Dersim Armenians, around 75% of the population in villages "
863,2366,18,"In several colonies, the establishment ceased to exist in practice at the Revolution, about 1776; this is the date of le"
864,1776,13,"In 1931, Hugo Cabret is a 12-year-old boy who lives with his father, a widowed, but kind and devoted master clockmaker i"
865,2162,15,"Cruithne is in a normal elliptic orbit around the Sun. Its period of revolution around the Sun, about 364 days at presen"
866,1586,16,Angeline and Heidi share a deep bond of friendship ever since Heidi was orphaned and was taken under the custody of Ange
867,1602,12,"Horrified by his actions, Kenai runs away in guilt, but Koda follows him. Upset, he confesses to Koda that he killed his"
868,1552,14,"Perugia was an Umbrian settlement but first appears in written history as ""Perusia"", one of the twelve confederate citie"
869,1550,8,"Kurapika is the sole survivor of the Kurta clan, an ethnic group whose irises that turn scarlet in emotional stress, who"
870,1864,16,The city of Lancaster has several museums that preserve its important contributions to society. The Demuth Museum is in 
871,1900,13,"The Río Branco Cup unfolded in three matches, with Matías González playing all of them, repeating in the first two the d"
872,1892,11,Firefighters are based at and respond to emergency situations from a Fire Station (Also Known As a Firehouse or Firehall
873,1518,8,"After Beamer urges the passengers to take action, Glick leads the group against a stunned Haznawi. Haznawi is tackled an"
874,2015,19,"The anise hyssop, ""Agastache foeniculum"" (also called blue giant hyssop) is a very different plant and not a close relat"
875,1749,35,"1. ""Intro""  0:33 2. ""Beware""  Christopher Rios Jerry Tineo JuJu 3:15 3. ""Super Lyrical"" (featuring Black Thought)  Rios "
876,1509,21,"The ""Bismarck"" and ""Tirpitz"" were planned in the mid-1930s by the German Kriegsmarine to counter France and its own nava"
877,1896,22,"Arlene, the first storm of the season, formed near Honduras on June 8 and moved north. It came close to western Cuba on "
878,1575,17,"""Make it Rain"" which features rapper Rowdy Rebel. He was in prison at the time and had to record his verse by telephone."
879,1672,15,"Alan is the son of the late Taiwanese stuntman-actor Blackie Ke. For his father, he wrote two songs, each in one of his "
880,1662,19,The Julian calendar has two types of year: common years of 365 days and leap years of 366 days. There is a simple cycle 
881,1645,16,McClellan had remained in command of the Army of the Potomac even though he had failed to support Major General John Pop
882,1547,9,"Within Afghanistan, the Astor Markhor is limited to the east in the high and mountainous monsoon forests of Laghman and "
883,1556,23,Delhi has the second largest Muslim population (12.86%) within Delhi State. Muhammad Ghori invaded India in 1175 A.D. Af
884,1672,12,Tom & Jerry (marketed as Tom and Jerry: The Movie) is an 2021 American live-action/animated slapstick comedy adventure m
885,1549,20,"46. Magic: Stanley reunites with his high school crush, Davida Steelmine, who is now working as a magician who uses her "
886,1738,21,When Leo XIII became pope in 1878 he tried to calm Church-State relations. In 1884 he told French bishops not to act in 
887,1892,16,"Darwin noticed that although young plants or animals are very similar to their parents, no two are exactly the same and "
888,1553,10,"During the season, Cavendish developed a remarkable partnership with his leadout man, Mark Renshaw. Continuing his run o"
889,1584,13,Oddworld: Abe's Exoddus was the second game in the series . It was released in November 1998 for the PlayStation video g
890,1936,10,"On 30 January 1948 BSAA G-AHNP ""Star Tiger"" was lost due to unknown causes while flying from Lisbon, Portugal to Bermuda"
891,1702,11,Other experimental observations can be explained by combining the overall expansion of space with nuclear physics and at
892,2322,17,"The 13 states are based on historical Malay Kingdoms. 9 of the 13 states, known as the Malay States, retain their royal "
893,1697,19,"Ruwen played first international in 2002. He's a modern defender, so he uses long pips and an attacking rubber on the fo"
894,1581,11,George goes to Nico's apartment and she discovers an address inside the clown's nose for the costume shop where it was p
895,2395,22,"In the middle of the 20th century, the Ba'ath parties were ruling both in Syria and Iraq. The ideology behind Ba'athism "
896,1888,34,"Abel sends his informant, Clarence Darlington, to trash the couple's home in yet another effort of forcing them out. Lis"
897,2117,12,The main event scripted into Vengeance was between D-Generation X (DX) Triple H and Shawn Michaels versus the Spirit Squ
898,1587,11,Chatterjee was killed on 7 August 2015. A group of about six men armed with machetes attacked him at his home in the Gor
899,2187,21,"Sidney, Jerry and Tom go back to the campus and find Derek in the auditorium tied to a crucifix, his mouth gagged with d"
900,1664,13,Zhang uses gardening sands he has in his pocket to escape the situation. Yang discovers an informant among the crew and 
901,2350,20,"The medical faculty of the Leipzig University was founded in 1415, a few years after the university itself was founded i"
902,2058,22,"In the late 1950s and early 1960s, sports were becoming more important to people. So, psychology of sports was more acce"
903,1773,10,"After Raiden reset the timeline in Mortal Kombat (2009), Quan Chi is present at the Shaolin Tournament from the outset, "
904,1748,11,"On November 26, 2014, Punk appeared on his friend Colt Cabana's ""Art of Wrestling"" podcast. During the podcast, Punk dec"
905,1938,15,"After gaining independence in 1991 with the end of the Soviet Union, Azerbaijan made the long and difficult change from "
906,1831,12,"One day, the KND are playing a videogame. While Numbuh 2 gives Numbuh 1 a training simulation helmet, which according to"
907,1774,26,"The main character Lloyd Irving and his friends, Genis Sage and Colette Brunel, are sent away from the town where Lloyd "
908,1707,12,Francetić earned his only military education and officer rank while serving the Kingdom of Yugoslavia Army. He became a 
909,1988,17,Nowruz has been celebrated by people from different ethnic communities and religious backgrounds for thousands of years.
910,1900,25,"Olive Thomas (October 20, 1894 – September 10, 1920) was an American silent movie actress and model. Her first movie, ""M"
911,1546,16,"""When prominent Ustashi [Ustaše] leaders claimed that they slaughtered a million Serbs (including babies, children, wome"
912,1706,14,"Queen Mother Moore (born Audley Moore; July 27, 1898 – May 2, 1997) was a strong African-American civil rights leader an"
913,1960,25,"Rather than ignore or accept the situation, Lincoln had to mend a broken nation or see it torn apart. Between the presid"
914,1561,13,"At the next race in Monaco, Verstappen qualified second behind Charles Leclerc, but Leclerc suffered a driveshaft failur"
915,1591,8,"The National Hurricane Center began monitoring a tropical wave that would later become Gamma around November 11, but the"
916,1954,20,"On September 20, 2007, the very successful manager José Mourinho left the club by ""mutual consent"". This exit came just "
917,1882,16,"Clark was born in Macon, Georgia. He graduated from LaGrange College in 1969 with a degree in the performing arts. A dec"
918,2328,21,Food shops have been around since antiquity. Originally each type of merchandise had a specialised shop where one would 
919,2345,18,"Epidemiological investigations may lead to a reductionist or limited point of view, medical anthropology provides a more"
920,1969,23,He defeated Jeff Hardy to again retain the WWE Title at the Royal Rumble. John Cena returned and won the 2008 Royal Rumb
921,1618,16,The color strong force is the strong interaction between the three quarks that a proton or neutron is made of. It is cal
922,1581,22,"Thurgood Marshall attended Frederick Douglass High School in Baltimore, Maryland and was in the class with the brightest"
923,2059,26,"In 674 Benedict Biscop, a Northumbrian nobleman, built a monastery known as Monkwearmouth. Egfrith, King of Northumbria "
924,2347,20,"The Military Commissions Act 2006 was passed on 17 October 2006, allowing trial in military court for war criminals. On "
925,1976,27,"In 1824, Governor Sir Thomas Brisbane asked Hovell to go with Hamilton Hume to explore the south part of New South Wales"
926,1585,9,"Today, South Koreans write using a mix of hangul (the native Korean alphabet) and hanja 漢子 (the Korean version of Chines"
927,1886,24,"Ocala has two main seasons: the dry season (October–May) and the wet season (June–September). During the dry season, the"
928,1749,7,In February 2010 the band recorded the album Untill March 2013 for their new album Bank Annocued Sheri next Album In Sep
929,1822,20,"Congress has several powers related to war and the armed forces. Under the War Powers Clause, only Congress may declare "
930,1595,13,"In another cutscene a human ship with Master Chief,Johnson and Cortana aboard follows the covenant ship through the port"
931,1656,25,Anil Kumble (full name:Anil Radhakrishna Kumble)is a retired Indian cricketer who captained Indian national cricket team
932,1997,15,The political problems that motivated the coup was due to the political instability in Turkey between the period of 1970
933,1637,14,"All Kenyans of school-going age are required to attend Primary School. However, school fees and required uniforms often "
934,1816,16,"Rani slowly begins to gain confidence by taking control of her decisions. Realizing her earning potential, she wins a co"
935,1555,18,"Toby is giving a puppet show for Monica, their mutual love becomes more obvious. When Baba comes home, she resumes her a"
936,1529,19,It happened on 2 May 2008. The storm was estimated to be category 4 (105 mph) Cyclone Nargis Caused destruction and at l
937,1623,15,"He made his national debut on 25 May 1942, in Buenos Aires against Uruguay, in the Copa Lipton match. He took part in mi"
938,1511,13,"Early on August 3, the Japan Meteorological Agency (JMA) upgraded an area of low pressure near Wake Island to a tropical"
939,1711,20,"Frogs in ""Pseudis"" find mates and lay eggs the same way most frogs do. However, their tadpoles are different. The tadpol"
940,1601,27,"Tanaka was born in Matsumoto on July 31, 1982. He played for Yokohama Flügels youth team. However Flügels was merged wit"
941,2093,17,"When Umm Kulthum first moved to Cairo, she continued singing religious songs in concerts and celebrations but did not fi"
942,1896,15,Rodger increasingly shared with his few friends his disturbing fantasies about dominating the world and committing acts 
943,1861,13,The words of Otani's citation explain: Staff Sergeant Kazuo Otani distinguished himself by extraordinary heroism in acti
944,1692,15,"Percy Jackson and Charles Beckendorf are on the same team for capture the flag. Beckendorf, a son of Hephaestus, has a s"
945,1512,12,"Vimto is a sweet drink created in 1908 in the centre of Manchester by Noel Nichols of Blackburn, Lancashire (1883–1966)."
946,1725,9,"In the span of 23 years, Lupu made over 20 recordings for Decca Records. His first recording was made in the spring of 1"
947,1817,10,The attacks reignited debates over gun control and the need for enhancements in the healthcare system in the United Stat
948,2083,24,"Vanuatu has diplomatic relations with more than 65 countries. It has a very small network of embassies. Only Australia, "
949,2072,21,In 1917 the Russian Revolution took place. The country was in a chaotic state so Prokofiev went to the United States. Af
950,1564,18,"After Hankerson signed a distribution deal with Jive Records, he signed Aaliyah to his label named Blackground Records w"
951,1651,6,The story rewinds to their final year at the ICE where Rancho and Farhan use the duplicate keys provided by Pia to break
952,1859,7,"In 1960, the first ""Popeye the Sailor"" animated television series was produced for first-run syndication which proved su"
953,1773,18,Suppose that you are organizing housing accommodations for a group of four hundred university students. Space is limited
954,1699,15,"Seeing his potential, FLN (National Liberation Front) militants explained to him that Algeria was a victim of colonialis"
955,2132,32,Judith's parents met at a restaurant in Los Angeles that was well known as a meeting place for immigrants. Maria worked 
956,2029,8,"Since the end of the Cold War and the formal end of colonialism, the Non-Aligned Movement has been forced to redefine it"
957,1544,21,In the 1960s Barbie's friends joined the line up of fashion dolls. Ken was her boyfriend and came to be in 1962. The Ken
958,1618,17,"Cheiron Studios was a recording studio. It was located at Kungsholmen, Stockholm, Sweden. It was founded in 1992 by Denn"
