block_id,len_chars,est_sentences,preview
192,1582,17,"A polynomial equation is an equation where you are only allowed to add and subtract multiples of powers of a variable, l"
193,1565,17,"The music video was filmed in Joshua Tree, California by Tango Productions. It was directed by Cecilia Miniucchi, who di"
194,1878,16,"Grand Est (; Alsatian: ""Grossa Oschta""; Moselle Franconian/; Rhine Franconian: ""Groß Oschte""; ; ) is an administrative r"
195,1557,12,Dead's mental state began to take a turn for the worse due to his fascination with death and his social situation. Becau
196,1887,9,"Over a flashback ten years prior, it is shown that Farhan joined the prestigious ICE in his first year of college, since"
197,1779,10,"At six years of age, Popeye began to fulfill his promise of taking his exercising more seriously and started devoting hi"
198,1729,21,Brazil faced Peru in the quarter finals. They won the game 4-2 and they defeated Teófilo Cubillas and Peru. Cubillas had
199,1742,18,"At school, Freak nearly dies when he chokes after eating American chop suey. Max alerts the nurse. Freak is taken to the"
200,1714,12,Simcoe got married to Elizabeth Posthuma Gwillim and he was elected to the House of Commons as a supporter of Prime Mini
201,1873,20,Machel Montano (born 24 November 1974) is a artist from Trinidad and Tobago. He is the lead of the soca band Xtatik. He 
202,2225,15,"His rivalry with Benjamin ended because Sheamus had already been moved to the Raw brand. He made his ""Raw"" debut by defe"
203,1835,9,Holmes reveals his deductive reasoning: the warning note had a woman's perfume scent; the theft of the shoes gave a clue
204,1626,16,"In 1920 Stravinsky’s family moved from Stravinsky to Brittany, then the following year they moved to Biarritz. Stravinsk"
205,1624,10,"After rising to army command early in 1917, Hutier began to apply the lessons learned from his three years of commanding"
206,1506,10,"When the ECW brand was discontinued, Tatsu made his debut for the Raw brand on the February 22, 2010 edition of Raw, and"
207,1671,14,The porous material will not allow larger molecules to pass so these molecules go to the next pore and again they cannot
208,1587,23,Shivaji Maharaj intended to capture as much of Adilshahi province and forts as possible. He captured the Adilshah forts 
209,2107,25,"The first firearms can be dated to about the 1200s in China. In Europe, the first gun barrels were made by p Italian cra"
210,1540,18,"Patrick is as a pink starfish who is silly, fat, lazy, immature, forgetful, rude, and generally ignorant. He has been sh"
211,1586,13,"Ernesto Lazzatti was born on September 25, 1915 in Ingeniero White, a neighborhood of Bahía Blanca, in the province of B"
212,1934,15,The Durrani Afghan forces and their allies finally won and defeated the Marathas. The place of battle field is disputed 
213,1604,12,"Upon arriving in England in June 1858, Morphy promptly challenged Staunton to a match. At first, Staunton declined Morph"
214,2149,21,"Every year the academy in Paris would hold a big exhibition (art show) called the ""Salon de Paris"". In 1863 an artist ca"
215,1990,27,"In 1116 Louis IV raided into Normandy again. Louis had supported Henry I's nephew, William Clito as the Duke of Normandy"
216,1608,16,"Being a complex man as a policy maker, many Koreans continue to hold Park in high regard in great part due to the indust"
217,1973,19,"On July 20, 2013, Rodger, wanting to lose his virginity days before his 22nd birthday, drank vodka to become drunk. He w"
218,1590,15,The GC-MS is made up of two major building blocks: the gas chromatograph and the mass spectrometer. The gas chromatograp
219,1795,18,"First of all, right pass is the most important requirement to be a good point guard. A point guard's first thought shoul"
220,1521,15,"In 1988 he became one of the four ""Jagadguru Ramanandacharyas"", the leaders of the Ramananda order. He is the founder of"
221,1859,15,The sex organs or genitals are used for sexual reproduction and for sexual intercourse. For sexual reproduction to happe
222,1608,13,"Catholics, like many Christians, accept the Nicene Creed, a combination of the Council of Nicaea (AD 325) and the later "
223,1525,18,"Stresemann was not, however, in any sense pro-French. His main preoccupation was how to free Germany from the burden of "
224,1532,10,"Analysts for the video game market considered 2009 to be critical to further success of the genre. Both the ""Guitar Hero"
225,1608,19,"Around 850, Saint Altfrid founded the ""Damenstift"", an abbey for women, ruled by a prince abbess. In this time the cathe"
226,1899,23,"Late in the afternoon, a ""Yorktown"" scout aircraft located ""Hiryū"". ""Enterprise"" launched a strike of dive bombers (incl"
227,2014,23,"England made their first appearance in a big women's tournament in 1984, where they finished as runners-up in the Europe"
228,1828,27,"In the North, the commander of ""1. Kavalleriedivision"", Major General Kurt Feldt, had to go over the Enclosure Dike beca"
229,1888,16,"In December 1997, Aardman and DreamWorks (later DreamWorks Animation) announced that their companies were teaming up to "
230,1603,106,"- Songs of my folk / Compiler of the Musical Literary Species Collection - F.A. Kildiyarova; scientific ed., comp. liter"
231,1805,29,Her parents were Juliana McLachlan and David Gardiner. Her parents belonged to a famous and wealthy family of New York. 
232,1797,19,The story itself begins with a young farm boy named Eragon finding a polished blue stone in the Spine (a smaller mountai
233,1677,24,Stuart learned from his trip with Sturt that large groups were not able to move quickly through the dry Australian lands
234,1556,25,"The other Interpromotional match on the card was between Randy Orton and The Undertaker, with Orton representing Raw and"
235,2139,16,"The People's Republic of Bulgaria was the official name of Bulgaria, when it was a socialist republic from 1946 to 1990."
236,1521,17,Töregene was friends with Ögedei's commanders in China. The fighting between the Mongols and the Song soldiers was in Ch
237,1618,17,The duality of Shiva's fearful and auspicious attributes appears in contrasted names. The name Rudra reflects Shiva's fe
238,1600,13,"The Book of the Dead was a series of almost two hundred spells represented as texts, songs and pictures written on papyr"
239,1955,28,"Grace Chatto, one of the members of Clean Bandit, told that London Evening Standard that the song was based on an experi"
240,2236,9,In Wales (and England) buildings with significant historical interest are often classified into either Grade I or Grade 
241,1940,34,"Max Kane helps Rachel run away from her overly religious and abusive stepfather. Rachel is nicknamed ""Worm"" because of h"
242,1605,17,The British annexed Assam into the Indian British Empire in 1826. After 1826 the Lower Assam and the Central Assam (Darr
243,1641,17,"Streptomyces are medically important, as they produce antifungals, antiparasitic drugs, antivirals, antitumorals, anti-h"
244,1553,18,"Jodi Lynn Picoult (born 19 May 1966 in Nesconsent, Long Island, New York) is an American author. Picoult comes from what"
245,1680,20,Thayer promoted the idea of “business antislavery”. The idea behind Thayer's Emigrant Aid Company was to level the playi
246,1771,13,"In the 19th century, several chemists discovered some fundamental concepts of the domain of organic chemistry. One of th"
247,1609,16,"As time passed, the gap between rich and poor increased. Frank Fontaine created charity organizations to support the und"
248,2096,15,"""This City"" is the first solo mainstream radio single released by American pop singer-songwriter Patrick Stump off the d"
249,2173,17,"As the controversy went further, the Wikipedia community began looking at Essjay's previous changes. Some felt he had re"
250,1509,16,In Hymenoptera there are many variations. The distinction between the 'parasitic' and the 'traditional' hymenoptera can 
251,1664,17,"Assistant Commissioner of Police Jai Dixit (Abhishek Bachchan), a no-nonsense cop, is called onto the case. Dixit seeks "
252,1977,17,"3 Idiots (stylized as 3 idiots) is a 2009 Indian Hindi-language coming-of-age comedy drama buddy film written, edited an"
253,1561,13,"In 1981, Marvin settled in Ostend, Belgium thanks to a former Belgian sports promoter and with his encouragement began r"
254,1831,16,"May Ying Chen (born 1948) is a labor organizer who specializes in immigrant workers rights. For more than twenty years, "
255,1590,17,Language starts as a tool external to the child used for social interaction. The child guides its behavior by using a ki
256,2299,11,"Like the Prime Minister, Premiers and Chief Ministers are the state/territory leader of the party that forms government."
257,1546,16,"Böhm was born in Graz, Austria. He wanted to be a musician, but his father said that he should study law first, because "
258,1510,20,"Sickles, not impressed with his new commander or his orders. He rode to Meade's headquarters about 11:00 a.m. and waited"
259,1723,12,The Pennsylvania Turnpike is a toll road (a road cars have to pay to drive on) operated by the Pennsylvania Turnpike Com
260,1529,22,"If someone wants to visit a Gurdwara, a certain protocol (or set of rules and expectations) must be followed. In Sikhism"
261,2050,22,"On October 8, 1988, 12 prisoners from Youngdeungpo Prison escaped into Seoul city during their transfer to Kongju Prison"
262,1925,19,"The relics of the Bronze Age like dolmens or patternless earthenwares were unearthed in Hyunpo, Namsu and Judongri. Acco"
263,1739,14,"Smith was born in Tacoma, Washington on January 22, 1939. He graduated from the University of Puget Sound with a degree "
264,1719,12,"After the cashier has scanned all of the goods, he or she will ask the customer for payment. If the customer is paying b"
265,1846,13,"Dissecting these components, it appears each element serves a purpose in its iconography of kingship. The recessed or ni"
266,2061,20,"As with Pluto, the narrator experiences a great fondness for the mysterious cat, which no one has seen before. The cat b"
267,1523,8,"The Java mouse-deer's common scientific name is ""Tragulus javanicus"", although other classification names for it exist, "
268,1514,22,After Charles IV there were many arguments and fights in Prague. A priest called Jan Hus said that the Catholic Church h
269,2333,19,"Harmonix, a company formed from a computer music group at MIT in 1995, released ""Frequency"" in 2001. The game allowed th"
270,1531,24,Piaget broke his stages of cognitive development of children into four stages. The stages always go in the same order. T
271,2301,20,"Narayani Sena (Gopayan) or Yadav(Ahir) Sena, the army of Lord Krishna of Dwarka Kingdom is called as the supreme sena of"
272,1561,10,"One of the featured matches was between John Cena and Sabu in an Extreme lumberjack match, a standard match with the exc"
273,1667,13,"Once he established himself at West Point, Arnold began systematically weakening its defenses and military strength. Nee"
274,1545,14,The main feud going into the event for the RAW brand was between WWE Champion John Cena and Randy Orton. The feud began 
275,1969,18,"""IGN"" readers ranked Charmander at #37 among the best Pokémon ever. ""Game Informer""s O'Dell Harmon ranked Charmander - a"
276,1598,28,What's My Line? is a panel game show. It ran weekly in the United States. The show aired on Sunday at 10:30 p.m. EST on 
277,1722,13,"Early on July 22, an area of low pressure formed to the east of Philippines. The system gradually drifted west over the "
278,1567,14,"The result was the Unified WWE Tag Team Championship, a combination of the two titles though both were kept active by th"
279,2349,19,"The battle started around 9:17 PM on the 23rd of January, 1813, with the British having around 500.000 Red Coats defendi"
280,1650,31,"Kongyamba and his men were waiting for Princess Thobi's return. When they saw the princess returning, his men shouted, """
281,1615,13,"However, there are many exceptions to these patterns. For example, some native Japanese words with two or more kanji (us"
282,1526,14,"The movie tells the story of two girls, Agnes and Elin, who go to school in the small town of Åmål. Elin is outgoing and"
283,2246,18,"Mia Wasikowska (born 14 October 1989) is an Australian movie, television, and voice actress who is mostly known for her "
284,1878,13,"Critical reception of Puss has been well liked, with reviewers praising him in the movies and describing him as ""cute"", "
285,1929,8,"in 2016, Japan Coast Guard surround an spill by a giant creature named ""Shin Godzilla"" as a first form attack Kamata to "
286,1502,15,"In the 4th century, in a Greek village that is now part of Turkey, there was a good man who would secretly given present"
287,1725,19,"It seems that Masaccio and Masolino happily planned a scheme of frescoes that went together is a pleasing way, even thou"
288,1737,20,"After a lot of talking to local officials by Rickey, the Royals were allowed to host a game involving Robinson in Dayton"
289,2304,26,Komaru Naegi and Toko Fukawa (from the first game) attempt to save the world from dangerous Monokuma robots. The events 
290,2175,20,"The ancient Egyptians wrote things on boats, boxes, and clay to keep track of what they had. They also put labels and pi"
291,2342,11,Ultraman is a Seijin from the Land of Light M-78. Many Ultramen are usually red and silver (although several different c
292,1588,14,"The story starts with Link in bed when a voice calls out to him. The voice is Princess Zelda's, and she asks for help es"
293,2003,24,"Eragon and Saphira bury Brom. They decide to go to the Varden to fight Galbatorix, with Murtagh who does not want to go,"
294,1827,12,"During the morning of August 8, Genevieve started to track northward along the western edge of a subtropical ridge to th"
295,2247,14,"Persian mythology, the phoenix means swan, a counterpart to the Indo-European and Chinese word phoenix, and appears to b"
296,1659,12,"Rodger went on to enroll in Pierce College but didn't stay, choosing to leave the institution after seeing too many happ"
297,1652,19,When King Robert returned his brother and his commanders criticized the king (as much as they dared) for risking his lif
298,1772,11,"French also complained about how often newspapers and television said people had been ""credibly accused"" of rape saying "
299,1573,14,"The start of the 2011 Australian Open saw all the seeds make it to the second round. But Gulbis, Querrey, who lost in th"
300,1751,10,The leader of the Nazis Adolf Hitler wanted to a create a country where all Aryans were treated equally. They spent heav
301,1593,21,"In 1983, Nintendo, a relatively small arcade company, released the Family Computer (Famicom for short) in Japan. It ende"
302,1730,20,"In 1764 he and Adam Babcock, another young New Haven merchant, became partners. Using the profits from the sale of the f"
303,1536,17,"Trump began his career at his father's real estate company, Elizabeth Trump & Son. He later renamed the company The Trum"
304,1686,22,They are descended from old warriors of Khas Kingdom. Chhetri dominated the military forces of Shah dynasty of Nepal. Th
305,1750,14,The Republic of Croatia was a republic within the Socialist Federal Republic of Yugoslavia in 1990 and 1991. The creatio
306,1862,12,"March was an inactive season, with only one tropical depression forming, Chedeng, which made landfall in Mindanao, befor"
307,1774,15,"As the book opens, Bella is driving a Mercedes Guardian that Edward has bought to protect her from getting into trouble."
308,1738,24,One day Ngambawm plucked a single hair of Khupching and he placed it under a stone which was near a waterfall of a strea
309,1905,12,"The German physician, physicist and chemist Julius Lothar Meyer developed a table of elements of a horizontal form in 18"
310,1628,22,"For the expansion of the Swaraj, conflict with the Mughals was inevitable. Emperor Aurangzeb appointed his uncle Shaista"
311,1537,15,"Grover is undercover once again, this time at a military school, where he discovers two children, Nico and Bianca di Ang"
312,2155,20,FC Twente was founded on 1 July 1965 as a combination of Sportclub Enschede and Enschedes Boys. The two professional foo
313,1674,13,"Augustine Azuka Okocha ( ; born 14 August 1973), commonly known as Jay-Jay Okocha, is a Nigerian former professional foo"
314,1561,12,"The first Spanish soldiers arrived in the city on November 15, 1533. Spanish ""conquistador"", or ""conqueror"", Francisco P"
315,1667,12,"The original equations dealt with a kind of vibrating body that would produce a wave, a little like the way a reed in an"
316,2072,18,"After Mr. Stark's death, Peter becomes very sad but vows to become stronger to honor him. He and Ned go on a class trip "
317,1539,19,"In 1966 she won her first ""international"" races in Prato and Adria (Rovigo). These victories allowed her to wear the blu"
318,1513,10,All of the political parties of the opposition—after the conclusion of the emergency—fought together against the Congres
319,1893,18,"The history of saffron growing reaches back more than 3,000 years. The wild plant from which the saffron crocus came was"
320,1715,21,"At this point in the siege, Lee's army had strengthened the Petersburg line. They dug breastworks out of rifle pits. At "
321,1816,22,"After the coronation, Shivaji Maharaj marched to the conquest of Phonda near Goa and captured it in April 1675. Then the"
322,1888,16,"After his early success, which Marvin had struggles with, Motown began to widen his role as a ladies man, having him rec"
323,2369,21,"The right creates a duty of the state. The duties include regulation and enforcement of environmental laws, control of p"
324,1586,12,"In October of 2016, Lay's solo career began with the release of ""what U need?"" as a surprise gift for his fans on his bi"
325,1725,16,"Then Jezebel declared to Ahab that Naboth was ""no longer alive, but dead"" and Ahab got up and took possession of Nahab's"
326,1564,10,"According to the DVD commentary, Sorkin intended to center the show on Sam Seaborn and the other senior staff with the p"
327,1557,14,"Even when her mother described her first play as dull and boring, she did not stop trying to succeed. Soon she became a "
328,1789,22,"Shen Bao was a newspaper published in Shanghai, China. It was published between April 30, 1872 and May 27, 1949, making "
329,1506,11,The Consulate General of the United States in Jerusalem was the diplomatic mission of the United States of America accre
330,1646,26,"There were many different opinions of Anne Boleyn's beauty. The Venetian diarist Marino Sanuto described Anne as ""not on"
331,1715,17,"Batman uses many different tools to help fight crime, these may vary based on the different iterations of batman. Notabl"
332,1621,18,Golden Harvest (嘉禾娛樂公司) is a film producer and distributor based in Hong Kong. It was the first Chinese film company to 
333,1843,14,"On May 13, 1917, Lucia and her two cousins, Jacinta and Francisco Marto, were herding sheep at a location known as Cova "
334,1797,11,"This exchange of plants and animals changed European, American, African, and Asian ways of life. Foods that had never be"
335,2003,18,"Richmond () is the capital of the Commonwealth of Virginia, in the United States. It is an independent city and not part"
336,1555,12,Ollanta Moisés Humala Tasso (; born 27 June 1962) is a Peruvian politician. He was the 65th President of Peru from 2011 
337,2059,21,"Turks feared the permanent occupation and Hellenization of parts of Anatolia, with Ionia falling under direct Athenian g"
338,1996,12,"The British gave Arnold a brigadier general's commission with an annual income of several hundred pounds, but only paid "
339,1795,12,"Koror had started a main group of five: Tom, Ian, Gregg, Jenn, and Katie, and those on the outside saw them as a threat "
340,1679,12,"In response and some fear to the storm's projected path into the Gulf of Mexico, prices for crude oil rose on the New Yo"
341,1860,28,Tchaikovsky's brother Modest changed the ballet's story a little for the revision. He gave the ballet a happy ending. Th
342,2032,9,"In a memorandum dated March 20, 1985, the Anglophone lawyer and president of the Cameroonian Bar Association, Fongum Gor"
343,2023,29,"Whatever their relationship was exactly, Edward II regarded Gaveston with great affection. From the beginning of his mar"
344,1610,11,Terry Fallis is a Canadian writer and humourist. Fallis was trained as an engineer at McMaster University in Ontario. Fa
345,1640,13,The king of Navarre Sancho Garcés IV was assassinated by his own brother in 1076. The Navarrese elected Sancho Ramirez o
346,1930,19,"For extra power, more air is needed to increase the energy evolved per unit of fuel. This is where forced induction must"
347,2183,19,"New versions of the vaccines are developed twice a year, as the influenza virus rapidly changes. While their effectivene"
348,1536,15,Some tools the workshop has are: <br>The the color of the pieces can be changed using a color palette which corresponds 
349,1543,18,"By the end of 1995, Olson unexpectedly left the band to spend more time with Williams (with whom he would later form the"
350,1817,18,The name Sandy [ san-dee ] is a given name. It can be used for both men and women. It is a short form of the names Alexa
351,1595,9,The Preamble tells of human rights violations because of sexual orientation and gender identity and explains what sexual
352,2218,11,The Free State of Prussia () was a state of Germany from 1918 to 1947. It was formed in 1918 in Weimar Republic after th
353,1824,16,"One of the options in the series uses typical health points, as in most fighting games, but the standard option in most "
354,1606,23,"On December 12, the morning was cold and foggy. Burnside sent more troops into the town but did nothing to organize an a"
355,1792,17,"William Henry Thornton was born, 9th March 1830. His father was head of the tax department Somerset house and they lived"
356,1589,16,"Selena started recording the first song for the album, ""I Could Fall in Love"", in late 1994. Selena was partnered with m"
357,2028,15,Broughton (2001 pop.: 24) was a former town in the Cape Breton Regional Municipality about 12 miles from the former city
358,1544,14,"James Berardinelli of ReelViews called ""Bridge to Terabithia"" ""easily the best family feature of the early year"". Ann Ho"
359,1553,25,"Rachel is the daughter of an interracial same-sex couple. She is Jewish and was named after Rachel Green from ""Friends""."
360,2239,20,"In 1137, Ramon Berenguer IV, Count of Barcelona accepted King Ramiro II of Aragon's proposal to marry Queen Petronila. T"
361,1882,12,A report of that five-ship voyage can still be seen on reliefs in Hatshepsut's mortuary temple at Deir el-Bahri. Through
362,1863,14,"When The Almighty tells Abraham he will kill everyone in Sodom and Gomorrah to punish them, Abraham asks The Almighty no"
363,1600,25,Roland Kollmann (8 October 1976 in Villach) is a former Austrian football player. He played as striker mainly for GAK. H
364,1777,11,The words of Hayashi's citation explain: Private Joe Hayashi distinguished himself by extraordinary heroism in action on
365,1910,21,"Coco is a playable character in ""Crash Team Racing"" and ""Crash Bash"". The epilogue of ""Crash Team Racing"" states that Co"
366,1505,15,"Some people in Brazil believe Alberto Santos-Dumont was the first person to fly an airplane, before the Wright Brothers."
367,1581,11,"On June 15, 2009, McMahon announced on a special three-hour edition of Raw that he had ""sold"" the WWE Raw franchise to D"
368,1877,21,The Bahá'í Faith is an Abrahamic religion started in the 1800s by an Iranian person called Bahá'u'lláh who was born in T
369,1673,12,"""Music of the Spheres"" debuted at number one on the UK Albums Chart, becoming the fastest-selling album in the country s"
370,2067,14,"Human Rights Watch criticised the Bush administration in its 2003 world report, stating ""Washington has ignored human ri"
371,1692,26,"Bando was born in Himeji on August 2, 1979. After graduating from Kotogaoka High School, he joined J1 League club Gamba "
372,1561,10,"Ter-Khachatryan or Ter-Khachatryants is an Armenian family, known from the XVIII century. First well-known representativ"
373,1978,20,The trains continued to finish at Epping or Loughton until 1949. At this time the London Passenger Transport Board's New
374,1635,14,"Very little is known about Beethoven’s childhood. He was baptized on December 17, 1770 and was probably born a few days "
375,2336,24,Nur Muhammad Taraki was the first leader of the DRA after the Saur Revolution in 1978. He was a founding member of the P
376,2062,15,"In the fifth book, ""Harry Potter and the Order of the Phoenix"", the Ministry of Magic has been waging a smear campaign a"
377,1636,16,"Betrayed when she was young by a lover, she comes to town and makes almost all the men in the town fall in love with her"
378,2382,20,"McKinley started working with local bands in the Dallas–Fort Worth area, before joining Smith Ballew in 1929, when he me"
379,1864,13,Poaching is now a major problem in the country. The main cause for poaching in Russia is the consequence of the social a
380,1598,11,News reporter Kimberly Wells (Jane Fonda) and her cameraman Richard Adams (Michael Douglas) are filming a special on nuc
381,1652,29,Homan first appeared on the wheelchair tennis tour in 2003. By the end of the season she had reached number 23. Homan di
382,1595,22,"By May 1865, Hall decided to leave New South Wales. But a man, Mick 'Goobang' Coneley, who had once given the gang help,"
383,1537,12,"From a young age, Lopez's Puerto Rican parents stressed the importance of work ethic and being able to speak English. Th"
